Code,Name,Type,Industry,ListingDate,Description,CreateTime,UpdateTime
300807,天迈科技,A股,计算机设备,2019-12-19,"ERP概念: 2023年03月01日回复称公司主营业务是基于车联网等技术,为城市公共交通提供整体解决方案,研发有智能调度、卫星定位、公交ERP、大数据决策分析等产品,助力公交企业实现运营和管理的数字化。; 电子后视镜: 2021年03月02日回复称公司开发的“电子后视镜盲区监测系统”,是基于光学图像处理、流媒体技术、视频存储、CAN数据传输等技术于一体的新型车载产品,可以实现前方盲区监测、两侧盲区监测预警、倒车盲区监测,对车身四周的盲区实现全覆盖。; EDR概念: 2021年11月26日回复称公司针对“两客一危”和货运车辆自主研发的TM9003汽车行驶记录仪是专为音视频监控、智能行车记录和无线数据传输开发的设备,可实现视频录像、汽车行驶信息记录和无线数据上传,同时配合中心软件可实现中央监控、远程管理及行驶状态数据分析,采集记录车辆行驶状态信息,实现对车辆及驾驶员状态的实时监督,同时通过对行驶数据的读取和分析,可以为交通管理职能部门处理交通事故提供依据。; 数据中心: 2020年11月13日回复称公司拥有自己建设的云计算大数据中心,为各地中小公交企业提供云平台服务,同时也为各地公交企业建设自己的私有云数据中心,输出天迈科技技术为公交客户提供强有力的支持和服务。; 冷链物流: 2021年12月17日回复称公司与凯雪冷链共同投资设立了郑州冷智电子电子科技有限公司,合作开发智慧冷链业务。; 百度概念: 2020年5月8日,公司公告称郑州天迈科技股份有限公司与北京百度网讯科技有限公司共同签署了《合作框架协议》。双方充分共享各自的优势资源,以增强双方的市场竞争力与行业竞争力,实现信息化与工业化的高度融合。; 工业互联: 2020年9月30日回复称公司的“车辆能源管理工业互联网平台”是基于车辆电子设备及配套设施领域全产业链、全价值链、全产品生命周期数据的互联互通,搭建车辆能源管理工业互联网平台。; 雄安新区: 2021年5月24日回复称公司中标的“基于国网产业融入的雄安新区电力特色街区改造课题策略研究技术服务项目”,主要服务内容是根据雄安新区城市总体规划、组团及片区规划和产业布局,编制基于国网产业融入的雄安新区电力特色街区改造方案。; 车联网(车路云): 2020年10月21日回复称公司主营业务为基于车联网技术为城市公交运营、管理及服务提供综合解决方案。; 新能源车: 2020年6月16日回复称公司目前关于新能源车辆的产品主要为新能源车的远程监控和故障诊断系统、充电桩及充电运营监控系统,公司可以为新能源车提供远程监控管理和充电服务。; 无人驾驶: 2020年12月3日招股书显示公司运用无人驾驶领域的最新成果,成功开发了营运车辆主动安全辅助驾驶系统,通过雷达、摄像头等传感器设备感知周围环境、监测行驶状态和司机的驾驶状态,提醒驾驶员注意行车安全、避免发生事故。; 人工智能: 2023年2月23日回复称公司智能驾驶相关产品侧重于公交的场景化应用,主要产品包括基于视觉和毫米波雷达的智能识别产品、基于V2X的车路协同产品、驾驶员行为分析系统及辅助刹车系统等。; 充电桩: 河南省发改委公示的首批充电设施运营商名单共有9家企业,其中之一就是天迈科技。; 大数据: 2020年7月27日回复称公司多年来专注于智慧交通和新能源智慧充电领域,在车联网、大数据、公交融合支付和新能源充电等方面积累了丰富的经验和技术。; 北斗导航: 2023年9月5日回复称,精确定位是实现高性能车载智能调度服务终端各项功能的重要前提,卫星定位导航技术是公司产品使用的核心技术之一。公司拥有北斗精确定位导航系列算法,实现了对公交车辆的精确实时定位,为公交运营企业准确了解车辆运营情况、优化运营组织、实现资源最大利用提供帮助,曾荣获“卫星导航定位科技进步奖三等奖”。; 智慧城市: 公司主营业务为基于车联网技术为城市公交运营、管理及服务提供综合解决方案。; 云计算: 2020年8月26日回复称公司云平台采用openstack技术,选用Easystack+XKSY产品,搭建易扩展、易使用、高性能、高可靠的云环境;RBDProxy是XSKY对接云平台的技术特性,用于云平台与XSKY对接实现线程收敛,降低资源开销,实现性能提升。; 移动支付: 2022年8月22日回复称公司长期以来为公交企业提供公交收银解决方案,构建了一整套完善的一卡通生态系统,可支持IC卡、二维码、银联云闪付、以及人脸支付等多种支付方式,满足乘客多样化支付与便捷出行的需求,降低企业收银工作中的人力成本,提高城市公共交通服务水平。",2025-04-29 20:14:29,2025-04-29 20:14:29
600973,宝胜股份,A股,电网设备,2004-08-02,"铜缆高速连接: 公司官网信息,公司产品SFP56 50G高速线缆适用于数据中心、高性能计算等高速通信场所,实现服务器与交换机、交换机与交换机之间高速率数据传输。; 低空经济: 2024年4月10日官微消息,作为低空经济最重要的载体之一,eVTOL成为航空科技发展的新热点。宝胜股份及其旗下沈阳沈飞线束科技作为航空电线电缆及电气线路互联系统(EWIS)领域集成解决方案厂商,大力布局低空经济产业。; 飞行汽车(eVTOL): 2024年4月10日官微消息,作为低空经济最重要的载体之一,eVTOL成为航空科技发展的新热点。宝胜股份及其旗下沈阳沈飞线束科技作为航空电线电缆及电气线路互联系统(EWIS)领域集成解决方案厂商,大力布局低空经济产业。; 大飞机: 宝胜股份成功开发航空电缆,或成为C919大飞机供应商,不同于普通电缆,航空电缆耐高温要求很高。目前,国内还没有企业能够生产出具有自主知识产权的航空电缆,刚下线的C919大飞机所用的航空电缆也是由国外供应商提供的。; 央国企改革: 最终控股股东为国务院国有资产监督管理委员会。; 超导概念: 公司的TF、PF低温超导电缆短样已经通过检测和论证,完成TF780米dummy 电缆生产,并通过论证和交付;PF910米dummy电缆正在生产;MB低温超导电缆完成工艺研究和试制,超导短样生产合同已经签订。超导电缆项目完成了6台低温超导电缆主要设备的安装和调试,并与西北有色金属研究院签定合作开发高温超导材料的制备技术协议。; 特斯拉: 2020年2月24日回复称公司全资子公司东莞日新传导研发的耐温线缆产品获得了特斯拉的认可和配套使用,也成为特斯拉公司该款产品唯一的量产供应商。; 铁路基建: 公司是国内最大的综合性电缆生产商,产品包括 200 多个品种、 22000 多个规格的裸铜线、电气装备用电缆、电力电缆、网络电缆、铁路信号电缆、矿物绝缘电缆、橡胶电缆、分支电缆等各种系列电线电缆。; 太阳能: 2020年年报显示子公司宝利鑫新能源开发有限公司以光伏电站开发运营和合同能源管理服务为核心业务。; 智能电网: 公司是集科研、设计、制造、销售于一体的大型电线电缆专业生产企业,是我国电线电缆行业发展最快的企业之一,产品覆盖到除光缆以外的电线电缆各个领域,含裸导体、电气装备用电缆、电力电缆、通信电缆等四大类别,专业生产180多个品种22000多个规格的产品,形成了系列化、规模化、成套化的产品群体,具备了为国内外各级重点工程提供全面、全方位服务的能力。公司2013年度计划实现营业收入105亿,材料成本90亿。; 核能核电: 2019年年报显示公司“核电站用和缓环境下1E级K3类电缆”被评为国际先进水平产品。",2025-04-29 20:14:29,2025-04-29 20:14:29
300054,鼎龙股份,A股,电子化学品,2010-02-11,"中芯概念: 2021年5月17日回复称公司抛光垫产品已通过长江存储、武汉新芯、中芯国际、合肥长鑫、华虹宏力、华力、士兰微、广州粤芯等国内主流晶圆厂的认证。; 柔性屏(折叠屏): 2019年1月19日回复称,公司PI浆料应用于柔性显示行业,其中以曲面手机和折叠屏手机应用为主。; 半导体概念: 集成电路芯片设计与制程工艺材料和数字图文快印与云打印业务板块是公司近年重点布局和发展的业务领域。; 光刻机(胶): 2023年3月13日回复称公司主要布局有显示用光刻胶(PSPI)和封装光刻胶(PSPI)产品。半导体光刻胶有较高的技术壁垒,目前主要产品为海外供应商垄断,国内客户采购以进口为主,目前下游客户对进口替代及供应链安全需求非常迫切。目前公司显示用光刻胶(PSPI)已经通过国内主流显示客户验证,正在逐步放量。公司封装用光刻胶(PSPI),在显示用PSPI的技术平台基础上,吸收了PI合成及产业化方面的技术经验,目前已经开始客户送样测试工作。; 国产芯片: 集成电路芯片设计与制程工艺材料和数字图文快印与云打印业务板块是公司近年重点布局和发展的业务领域。; OLED: 2020年6月5日回复称公司产品柔性显示基材PI浆料是成为柔性OLED显示面板的关键制程材料之一,适用于折叠手机。",2025-04-29 20:14:29,2025-04-29 20:14:29
301038,深水规院,A股,工程建设,2021-08-04,"新型城镇化: 2021年年报显示公司主营业务是为水务建设工程及其配套工程提供勘测设计、规划咨询、项目运管等专业技术服务。公司以“水”为核心,围绕水资源、水安全、水环境三个方向,致力于系统解决城市水问题,核心业务是面向水利和市政给排水建设工程领域的勘测设计。; 地下管网: 2021年半年报显示公司承接深圳龙华、坪山、光明等原特区外待完善的管网工程设计,在解决提升城市排水能力时,借鉴香港、新加坡的经验,采取深层隧道的思路,承担了南山、前海深隧排水工程设计,探索了新的市政管网设计思维,摈弃了传统管网过度依赖路网的思维,探索并实践了管网协同水网。; 抽水蓄能: 2022年7月22日回复称目前公司新能源产业集中在生态储能方向的抽水蓄能业务。; 海绵城市: 2021年7月9日招股书显示公司基于“海绵城市”的概念,构建了“分区设防、雨洪分治、立体排水、智慧管控”的规划体系。公司设计完成的宝安区沙井片区排涝工程、桥头片区排涝工程、坝光片区防洪(潮)排洪、围海造地工程等城市防洪工程为片区防灾提供了安全保障。; 央国企改革: 公司的实际控制人为深圳市人民政府国有资产监督管理委员会。; 粤港自贸: 公司注册地址位于深圳市龙华区民治街道龙塘社区星河传奇花园三期商厦1栋C座1110。; 水利建设: 2021年7月9日招股书显示公司项目运管业务是指基于水利建设领域一体化咨询的技术优势,为客户提供项目管理及运行维护等服务,主要包括水环境治理设计运营一体化业务、项目管理类业务、河道管养类业务、监测类业务四类。; 深圳特区: 公司注册地址位于深圳市龙华区民治街道龙塘社区星河传奇花园三期商厦1栋C座1110。",2025-04-29 20:14:29,2025-04-29 20:14:29
603979,金诚信,A股,采掘行业,2015-06-30,"磷化工: 2020年年报显示公司已拥有贵州两岔河磷矿采矿权。; 一带一路: 近20年海外业务发展,已涉足非洲(刚果、赞比亚)、塞尔维亚、印尼; 黄金概念: 投资哥伦比亚铜金银矿山资源; 化工原料: 收购贵州两岔河磷矿资源",2025-04-29 20:14:29,2025-04-29 20:14:29
